{
  "schema_version": "1.0.0",
  "id": "LB-20261009-0001",
  "country": "LB",
  "record_type": "incident",
  "occurred_at": "2026-10-09T14:30:00+03:00",
  "date_precision": "exact",
  "reported_at": "2026-10-09T15:05:00+03:00",
  "incident_group": "fire",
  "nfirs_type": 111,
  "property_class": "industrial_warehouse",
  "occupancy_detail": "sponge factory",
  "cause_reported": "under_investigation_unknown",
  "origin": "accidental",
  "deaths": 0,
  "injuries": null,
  "asphyxiation_cases": 2,
  "displaced": null,
  "structures_destroyed": null,
  "responders": ["civil_defense"],
  "severity": 3,
  "place_text": "بلدة المثال - قضاء المثال",
  "admin1": null,
  "admin2": null,
  "admin3": null,
  "lat": null,
  "lon": null,
  "location_precision": "unknown",
  "sources": [
    {
      "outlet": "civil_defense",
      "url": "http://civildefense.gov.lb/index.php?mact=News,cntnt01,detail,0&cntnt01articleid=1&cntnt01returnid=110",
      "headline": "Synthetic test headline",
      "published_at": "2026-10-09T15:05:00+03:00",
      "source_type": "official",
      "is_upstream": true,
      "raw_ref": "raw/civil_defense/2026-10/0000.json"
    }
  ],
  "official_record_id": null,
  "summary": "Synthetic record used only by tests.",
  "evidence": {"asphyxiation_cases": "synthetic quote"},
  "confidence": 0.9,
  "status": "auto",
  "tags": [],
  "created_at": "2026-10-09T16:00:00+03:00",
  "updated_at": "2026-10-09T16:00:00+03:00",
  "revision_note": null
}
